##################################################;;;;;;;;;;;;;;x
EVTDESC9105931;The Semovente da 90/53 was a heavy Italian self-propelled gun and tank destroyer, used by the Italian and German Armies during World War II.  The Semovente da 90/53 was created by mounting a 90 mm Cannone da 90/53 anti-aircraft gun on top of an enlarged chassis of a M14/41 tank. Only 30 of these vehicles were produced, all in 1942. This low production was due to Italy's limited industrial capability at the time, as well as high demand for the 90 mm gun for regular anti-aircraft duties.  The Semovente da 90/53 was primarily developed in response to demands by Italian forces on the Eastern Front for a vehicle-mounted anti-tank weapon that could take on Soviet T-34 and KV tanks. Italian armoured forces on the Eastern Front were equipped only with the L6/40 tank and Semovente 47/32 self-propelled gun; neither of these had the firepower to cope with the Soviet medium and heavy tanks. However, no Semoventi da 90/53 were ever sent to the Eastern Front.  The major drawback of the Semovente da 90/53, as with many self-propelled gun types of World War II, was the open top and rear of the gun compartment, which left the gun crew exposed to shrapnel and small arms fire. In addition, the Semovente da 90/53 had little or no armour in most areas. Because these vehicles were designed to operate far enough away from enemy vehicles to not be subject to incoming fire, this was initially not considered a problem. The small ammunition capacity of the vehicle was also a problem, only six rounds could be carried. This necessitated the creation of special ammunition carriers out of Fiat L6/40 tanks, one accompanying each Semovente da 90/53 in the field. The L6 ammunition carrier itself carried 26 rounds along with an additional 40 rounds in a towed trailer. It fired Effetto Pronto, or HEAT rounds, which could pierce 70 mm armour plating at a range of 2,200 meters.;;;;;;;;;;x
EVTNAME9105932;New Advanced Semi-Automatic Rifle Design: The Beretta Model 59 (BM59);;;;;;;;;;;x
EVTDESC9105932;The Beretta BM59 is an Italian-made rifle based on the M1 Garand rifle, but chambered in 7.62x51mm NATO, and modified to use a detachable magazine. Later revisions incorporated other features common to more modern rifles.  After World War II, Italy adopted the US-designed M1 Garand rifle in .30-06 Springfield (7.62x63mm) and also manufactured it under license. This semi-automatic rifle proved itself well during World War II, but in the late 1950s it was considered outdated and obsolete and the Italian military also wanted a new rifle chambered for the NATO-standard 7.62x51mm round.  To meet these requirements, Beretta designed the BM59, which was essentially a rechambered M1 fitted with a removable 20-round magazine, folding bipod and a combined flash suppressor/rifle grenade launcher. The BM59 is capable of selective fire.;;;;;;;;;;x
EVTNAME9105933;New Advanced Submachine Gun Design: The Beretta Modello 12;;;;;;;;;;;x
EVTDESC9105933;The Beretta Model 12 is a 9x19mm Parabellum caliber submachine gun designed by Beretta. The production started in 1962, the first users were the Italian Carabinieri and the Italian State Police even though in limited number, only in 1978 it was widely issued replacing the old Beretta MAB. In 1962 the Italian Army bought a limited number of Franchi LF57 submachine gun, judged better than the M12 but never issued to the troops, and only in 1992 the M12S2 variant was introduced also if in very limited number. The Italian Air Force, instead, bought a large number of M12S and M12S2 for the airport security units.;;;;;;;;;;x
EVTNAME9105934;New Advanced Submachine Gun Design: The Franchi LF-57;;;;;;;;;;;x
EVTDESC9105934;The Franchi LF57 is an Italian made pressed-metal submachine gun. A small number were made for the Italian Navy in the 1960s, but few others ordered it. The LF57 uses a recessed bolt head similar to the Beretta Model 12's as a method of reducing the weapon's length, although on the LF57 the bolt's mass is carried above the barrel rather than around it. This allows manufacture to be simplified to a degree. Most parts are made of stampings and pressings, and the two sides of the gun are one piece each, joined by a long seam. Dismantling the weapon is very simple, such as the barrel, which is held on by one single barrel nut. The tubular butt folds to the right side of the receiver, and the pistol grip is made entirely of steel. The sights are simple fixtures on the top of the barrel. Also it was rapidly known as the "Dead Squirrel" due to its low ammunition capacity.;;;;;;;;;;x
##EOF;;;;;;;;;;;;;;x